{
  "$schema": "https://json-schema.org/draft/2020-12/schema",
  "$id": "https://raw.githubusercontent.com/tlgkccampbell/vibecheck/master/schema/vibecheck.schema.json",
  "title": "Architecture map",
  "description": "The checked-in description of a system's nodes, bindings, views and exclusions. See docs/vibecheck-spec.md.",
  "type": "object",
  "additionalProperties": false,
  "required": ["version", "solution", "exclude", "nodes", "views", "externals"],
  "properties": {
    "version": { "const": 0 },
    "solution": { "type": "string", "description": "The solution file, relative to the repository root." },
    "exclude": { "type": "array", "items": { "type": "string" }, "description": "Type patterns naming the types that are not part of the system. An excluded type is not partitioned and creates no edges." },
    "tests": { "type": "array", "items": { "type": "string" }, "description": "Type patterns naming the test types. A test type binds to nothing and creates no edges, but the analysis keeps it as evidence about the system. A type that exclude also matches is excluded. See docs/tests.md section 3.1." },
    "patterns": { "type": "array", "items": { "$ref": "#/$defs/pattern" }, "description": "Entries that name, declare or ignore the patterns a review finds among the types. See docs/patterns.md section 4.4." },
    "nodes": {
      "type": "object",
      "propertyNames": { "$ref": "#/$defs/identifier" },
      "additionalProperties": { "$ref": "#/$defs/node" }
    },
    "views": {
      "type": "object",
      "propertyNames": { "$ref": "#/$defs/segment" },
      "additionalProperties": { "$ref": "#/$defs/view" }
    },
    "externals": {
      "type": "object",
      "propertyNames": { "$ref": "#/$defs/segment" },
      "additionalProperties": { "$ref": "#/$defs/external" }
    }
  },
  "$defs": {
    "segment": { "type": "string", "pattern": "^[a-z0-9-]+$" },
    "identifier": { "type": "string", "pattern": "^[a-z0-9-]+(\\.[a-z0-9-]+)*$" },
    "node": {
      "type": "object",
      "additionalProperties": false,
      "required": ["name"],
      "properties": {
        "name": { "type": "string" },
        "purpose": { "type": "string" },
        "category": { "enum": ["entry", "feature", "domain", "analysis", "transform", "integration", "foundation", "tooling"], "description": "The broad category of the node's role. A node without one takes its nearest ancestor's." },
        "note": { "type": "string" },
        "bind": { "type": "array", "minItems": 1, "items": { "type": "string" }, "description": "Patterns over fully qualified type names, with * (no dots) and ** (any) wildcards and an optional Assembly:: qualifier. Present on leaves only." }
      }
    },
    "key": { "type": "string", "pattern": "^(inherits|implements|attribute|suffix):.*\\S", "description": "A trait that types share: inherits:, implements: or attribute: and the open name of a type, such as implements:MassTransit.IConsumer<>, or suffix: and the text a type's name ends with." },
    "pattern": {
      "oneOf": [
        {
          "type": "object",
          "additionalProperties": false,
          "required": ["id", "keys"],
          "properties": {
            "id": { "$ref": "#/$defs/segment" },
            "name": { "type": "string" },
            "purpose": { "type": "string" },
            "keys": { "type": "array", "minItems": 1, "items": { "$ref": "#/$defs/key" }, "description": "The keys every instance carries. The entry names the pattern discovery finds with these keys, or declares it." }
          }
        },
        {
          "type": "object",
          "additionalProperties": false,
          "required": ["ignore"],
          "properties": { "ignore": { "$ref": "#/$defs/key", "description": "A key whose group discovery drops, such as a marker interface every message carries." } }
        }
      ]
    },
    "view": {
      "type": "object",
      "additionalProperties": false,
      "required": ["name", "level", "groups"],
      "properties": {
        "name": { "type": "string" },
        "purpose": { "type": "string" },
        "level": { "type": "string", "description": "root or a container identifier. The view's groups partition the leaves under it." },
        "groups": {
          "type": "object",
          "minProperties": 1,
          "propertyNames": { "$ref": "#/$defs/segment" },
          "additionalProperties": {
            "type": "object",
            "additionalProperties": false,
            "required": ["name", "leaves"],
            "properties": {
              "name": { "type": "string" },
              "purpose": { "type": "string" },
              "leaves": { "type": "array", "minItems": 1, "items": { "$ref": "#/$defs/identifier" } }
            }
          }
        }
      }
    },
    "external": {
      "type": "object",
      "additionalProperties": false,
      "required": ["name", "bind"],
      "properties": {
        "name": { "type": "string" },
        "purpose": { "type": "string" },
        "bind": { "type": "array", "minItems": 1, "items": { "type": "string" }, "description": "Assembly name patterns, with * as a wildcard." }
      }
    }
  }
}
